{
  "policy_id": "synthetic-p20-2-policy",
  "version": "1",
  "default_requirement_state": "UNSET",
  "target_cells": [
    {
      "cell_id": "test_region.zz.national_media",
      "geography_scope": "TEST_REGION",
      "language": "zz",
      "source_type": "NATIONAL_MEDIA",
      "topic_role": null,
      "requirement_state": "REQUIRED",
      "thresholds": {
        "minimum_source_count": 2,
        "minimum_independent_origin_count": 2,
        "minimum_healthy_source_count": 1,
        "maximum_stale_share": 0.5,
        "maximum_dominant_origin_share": 0.5
      },
      "policy_reason": "Synthetic required cell used only to validate deterministic threshold semantics."
    },
    {
      "cell_id": "test_region.yy.wire_service",
      "geography_scope": "TEST_REGION",
      "language": "yy",
      "source_type": "WIRE_SERVICE",
      "topic_role": null,
      "requirement_state": "OPTIONAL",
      "thresholds": {
        "minimum_source_count": 0,
        "minimum_independent_origin_count": null,
        "minimum_healthy_source_count": null,
        "maximum_stale_share": null,
        "maximum_dominant_origin_share": null
      },
      "policy_reason": "Synthetic optional zero-observation cell proving that policy can represent expected cells absent from observed coverage."
    }
  ]
}
